Английский пр. 42-50; восточная сторона между Грибоедова и Канонерской
Английский пр. 52; восточная сторона между Тургенева и Лабутина
Дерптский пер. 2; восточная сторона между Фонтанкой и Рижским
Лермонтовский пр. 1-5; западная сторона между Декабристов и Союза Печатников, кроме "Дома Быта" в доме 1
Лермонтовский пр. 7-9; западная сторона между Союза Печатников и Римского-Корсакова, кроме БЦ в доме 7
Рижский пр. 15-21; северная сторона между Дерптским и Циолковского
Рижский пр. 23-31; северная сторона между Циолковского и Старо-Петергофским
Старо-Петергофский пр. 6; восточная сторона между Рижским и Курляндской
Старо-Петергофский пр. 21-23; западная сторона между Курляндской и Обводным
